<?xml version="1.0" encoding="UTF-8"?>
<minihtml xmlns:xsi="http://www.w3.org/2001/XMLSchema-instance"
          xsi:noNamespaceSchemaLocation="minihtml.xsd">

  <h1>Bienvenidos a MiniHTML</h1>

  <p>Este es un <b>ejemplo</b> de contenido en <i>MiniHTML</i>.</p>

  <a href="https://ejemplo.com">Visítanos aquí</a>

  <img src="logo.png" alt="Logotipo"/>

  <ul>
    <li>Elemento 1</li>
    <li>Elemento 2</li>
  </ul>

  <ol>
    <li>Paso 1</li>
    <li>Paso 2</li>
  </ol>

  <hr/>

  <pre>
function saludar() {
  console.log("Hola, mundo!");
}
  </pre>

</minihtml>

